ticker,company_name,current_price,currency,value_score,conviction_grade,conviction_score,conviction_reasons,conviction_positives,conviction_red_flags,sector,market,market_flag,market_cape,target_price_analyst,analyst_upside_pct,analyst_count,fcf_yield_pct,risk_reward_ratio,dividend_yield_pct,buyback_active,roe_pct,pe_forward,pe_trailing,profit_margin_pct,revenue_growth_pct,pct_from_52w_high,risk_flags,nasdaq_adr,ai_verdict,ai_notes,scan_date
030200.KS,KT Corporation,60000.0,KRW,37.0,C,37.0,P/E 9.1x | Potencial +18% | Dividendo 4.9%,0,0,Communication Services,Korea,🇰🇷,21.2,70824.8,18.0,25,,2.26,4.92,,9.8,9.1,,6.5,4.1,-13.5,incomplete_data | potential_accounting_issues,,SUSPECT,"Trailing P/E is reported as non-existent, which is unusual for a publicly traded company like KT Corporation.",2026-03-17
7267.T,"Honda Motor Co., Ltd.",1342.0,JPY,37.0,C,37.0,P/E 5.9x (vs 16x mercado) | Potencial +20% | Dividendo 5.2% | Mercado Japan CAPE 29 (26% descuento histórico),1,0,Consumer Cyclical,Japan,🇯🇵,29.4,1606.83,19.7,18,0.8,2.47,5.21,,4.3,5.9,10.8,2.3,-3.4,-22.4,cyclical risk | geopolitical risk,,SUSPECT,Low forward P/E and high dividend yield may indicate undervaluation or underlying issues,2026-03-17
1211.HK,BYD Company Limited,104.5,HKD,37.0,C,37.0,ROE 18.5% | Potencial +20% | FCF negativo | Mercado HongKong CAPE 11 (33% descuento histórico),3,1,Consumer Cyclical,HongKong,🇭🇰,10.7,125.41,20.0,28,-4.9,2.5,1.39,,18.5,18.6,65.7,4.6,-3.1,-34.2,cyclical risk | governance risk | regulatory risk,BYDDF,RISKY,Negative FCF yield and high trailing P/E indicate potential investment risks,2026-03-17
028260.KS,Samsung C&T Corporation,279500.0,KRW,36.0,C,36.0,Potencial +29% | FCF negativo | Dividendo 1.0%,1,1,Industrials,Korea,🇰🇷,21.2,359687.5,28.7,16,-0.1,3.59,1.01,,8.2,16.3,,6.0,8.4,-23.2,cyclical | governance,,SUSPECT,Negative FCF yield is anomalous for an industrials company,2026-03-17
ABEV3.SA,Ambev S.A.,15.1,BRL,35.0,C,35.0,ROE 17.0% | FCF yield 5.3% | Mercado Brazil CAPE 9 (34% descuento histórico),3,0,Consumer Defensive,Brazil,🇧🇷,9.0,15.09,-0.1,18,5.3,-0.01,7.38,,17.0,13.4,15.3,17.6,-8.2,-10.0,Ingresos en declive YoY | cyclical risk | geopolitical risk,ABEV,RISKY,Negative revenue growth and low analyst upside raise concerns,2026-03-17
